{
  "corpus_id": "staging-tool-type-6ebb8ac9d856",
  "counters": {
    "current_label_corpus": 54,
    "distinct_products": 54,
    "historical_label_collisions": 2,
    "raw_applied_changes": 56
  },
  "expected_recall": 0.59,
  "extracted_at": "2026-07-21T20:04:20.076308+00:00",
  "items": [
    {
      "applied_at": "2026-07-19T18:00:59.215738+00:00",
      "applied_option_slug": "obor-shlangi",
      "article": "73410",
      "brand": "",
      "change_id": "98d285dc-bae9-4b95-8431-e909060b27d9",
      "confidence": 80,
      "facts_hash": "c117bad0208b0bb056990767240a69d4d2c4f6fc574a57f4a0810a8b4baa7927",
      "name": "Насадка на насос",
      "original_name": "Насадка на насос",
      "pav_id": 63019,
      "product_id": 257,
      "source": "web",
      "source_group": "Автомобильный инструмент"
    },
    {
      "applied_at": "2026-07-20T13:03:34.478686+00:00",
      "applied_option_slug": "krep-takelazh",
      "article": "980065I",
      "brand": "",
      "change_id": "cb5b6637-b596-42c6-b05a-9400aed39908",
      "confidence": 85,
      "facts_hash": "b52e4e28e7a3cdb46eb612f7dc05e4a002a38cfb2012bd53a2bdb01b09ec400b",
      "name": "Стяжка груза  1089кг 4,87мх3,17см САТ (4шт)",
      "original_name": "Стяжка груза  1089кг 4,87мх3,17см САТ (4шт)",
      "pav_id": 63030,
      "product_id": 307,
      "source": "web",
      "source_group": "Автомобильный инструмент"
    },
    {
      "applied_at": "2026-07-19T13:56:31.878947+00:00",
      "applied_option_slug": "fonari",
      "article": "0615990EN6",
      "brand": "",
      "change_id": "4defdc63-4f5c-4c65-bb6c-a493a43d5012",
      "confidence": 92,
      "facts_hash": "d387822288d1addba61a9f9a3bfa17a7bd254fb318abefb3975d97fe5681574f",
      "name": "Фонарь BOSCH GLI 14,4 V-LI (без аккум.и зар.устрой",
      "original_name": "Фонарь BOSCH GLI 14,4 V-LI (без аккум.и зар.устрой",
      "pav_id": 63011,
      "product_id": 667,
      "source": "web",
      "source_group": "Аккумуляторный инструмент"
    },
    {
      "applied_at": "2026-07-19T18:03:59.399657+00:00",
      "applied_option_slug": "adaptery",
      "article": "40309-BM",
      "brand": "",
      "change_id": "7eb9a23f-46bd-4a45-894f-ea45b82e849f",
      "confidence": 90,
      "facts_hash": "a40a3275bbfece132171a9fb572bda6875ee3f6303fefa12793dbf0cfc6fb09e",
      "name": "Адаптер-переходник для инструмента BOSCH с аккум MAKITA",
      "original_name": "Адаптер-переходник для инструмента BOSCH с аккум MAKITA",
      "pav_id": 63020,
      "product_id": 1110,
      "source": "web",
      "source_group": "Аккумуляторы и зарядные устройства"
    },
    {
      "applied_at": "2026-07-20T10:45:09.534913+00:00",
      "applied_option_slug": "adaptery",
      "article": "40309-DM",
      "brand": "",
      "change_id": "875fa24e-f43d-491a-b8a4-7f217a50ffba",
      "confidence": 92,
      "facts_hash": "781794722baba6ce0729a0e2eed809a2746ec6e6b11da8a197d7fd8d8d71ce1c",
      "name": "Адаптер-переходник для инструмента DEWALT с аккум MAKITA",
      "original_name": "Адаптер-переходник для инструмента DEWALT с аккум MAKITA",
      "pav_id": 63025,
      "product_id": 1111,
      "source": "web",
      "source_group": "Аккумуляторы и зарядные устройства"
    },
    {
      "applied_at": "2026-07-20T13:03:35.094520+00:00",
      "applied_option_slug": "zap-svechi",
      "article": "CBCJ7Y",
      "brand": "",
      "change_id": "145daa06-6d7a-46f4-a18a-9fd00f85e10b",
      "confidence": 95,
      "facts_hash": "8feed9536fc49ce2577705cd6e0515710c6bad0bad0eb8c2f80a31181f09cda9",
      "name": "Свеча зажигания для 2- такт CJ7Y MD-STARS",
      "original_name": "Свеча зажигания для 2- такт CJ7Y MD-STARS",
      "pav_id": 63031,
      "product_id": 1817,
      "source": "web",
      "source_group": "Бензоинструмент и расходники для них"
    },
    {
      "applied_at": "2026-07-20T13:03:35.337936+00:00",
      "applied_option_slug": "yashchiki-sumki",
      "article": "C1013",
      "brand": "",
      "change_id": "8667d89c-2c61-451e-b764-150f06d71a8a",
      "confidence": 92,
      "facts_hash": "c1854d05624ac4ad49f3550728e3c1f33f1a45572a141e8ac3648e34c94ff62c",
      "name": "Сумка для бензопилы CHAMPION",
      "original_name": "Сумка для бензопилы CHAMPION",
      "pav_id": 63032,
      "product_id": 1855,
      "source": "web",
      "source_group": "Бензоинструмент и расходники для них"
    },
    {
      "applied_at": "2026-07-20T14:41:12.261464+00:00",
      "applied_option_slug": "obor-pena",
      "article": "71/5/41",
      "brand": "",
      "change_id": "0b88c13a-bce2-4676-be19-c6b841f460fc",
      "confidence": 93,
      "facts_hash": "c2364cfe8284d1d7a691103451299382b905f8fc28306f9e10cad8eede9bd360",
      "name": "Шампунь для минимоек HUTER Active Foam 5,8кг",
      "original_name": "Шампунь для минимоек HUTER Active Foam 5,8кг",
      "pav_id": 63039,
      "product_id": 6213,
      "source": "web",
      "source_group": "Герметики, пены, клеи и пр отделочные материалы"
    },
    {
      "applied_at": "2026-07-18T20:06:07.834238+00:00",
      "applied_option_slug": "adaptery",
      "article": "T7-LMS",
      "brand": "",
      "change_id": "540d81c9-1e4e-4d36-b2cd-0aee25a52483",
      "confidence": 95,
      "facts_hash": "3424600b469e2c51a83e594588f70d21994e660a176e49ddcc9e15e34fa9cc59",
      "name": "Адаптер  для АКБ под инструмент 20V Max под инструмент LMS, Профессионал",
      "original_name": "Адаптер  для АКБ под инструмент 20V Max под инструмент LMS, Профессионал",
      "pav_id": 62992,
      "product_id": 6681,
      "source": "web",
      "source_group": "Запасные части"
    },
    {
      "applied_at": "2026-07-18T20:18:47.928520+00:00",
      "applied_option_slug": "adaptery",
      "article": "LMS-T7",
      "brand": "",
      "change_id": "12df33fa-377d-4bac-924a-cd3d897364ee",
      "confidence": 90,
      "facts_hash": "5f3d172b7dc35d457dc611da1aa89af3535e6dd41157fa0acaa9136642594fa3",
      "name": "Адаптер для АКБ LMS под инструмент 20V Max, Профессионал",
      "original_name": "Адаптер для АКБ LMS под инструмент 20V Max, Профессионал",
      "pav_id": 62997,
      "product_id": 6682,
      "source": "web",
      "source_group": "Запасные части"
    },
    {
      "applied_at": "2026-07-18T20:26:24.662798+00:00",
      "applied_option_slug": "adaptery",
      "article": "64044-200",
      "brand": "",
      "change_id": "6ceb005d-a3d8-4078-aa55-4fe687829339",
      "confidence": 92,
      "facts_hash": "4d8820aab8f8a46a098878dbb4a0ec3343deb5439d878b380df8beea48496bfe",
      "name": "Адаптер динамометрический электронный 40-200Нм 1/2\" с переходниками  1/4, 3/8 KRAFTOOL",
      "original_name": "Адаптер динамометрический электронный 40-200Нм 1/2\" с переходниками  1/4, 3/8 KRAFTOOL",
      "pav_id": 63002,
      "product_id": 10537,
      "source": "web",
      "source_group": "Измерительный инструмент"
    },
    {
      "applied_at": "2026-07-20T14:41:18.414339+00:00",
      "applied_option_slug": "izm-shtativy",
      "article": "34704",
      "brand": "",
      "change_id": "39588444-5b47-4ed5-8df8-befec36dd8f4",
      "confidence": 94,
      "facts_hash": "ecf2fe6e9095b90f919f3798766f2083cde2367a1de87de29897a2b8ab7b4c3e",
      "name": "Держатель клипса универсальный шарнирный KRAFTOOL MM2",
      "original_name": "Держатель клипса универсальный шарнирный KRAFTOOL MM2",
      "pav_id": 63040,
      "product_id": 10631,
      "source": "web",
      "source_group": "Измерительный инструмент"
    },
    {
      "applied_at": "2026-07-19T13:56:32.125514+00:00",
      "applied_option_slug": "izm-shtativy",
      "article": "34708",
      "brand": "",
      "change_id": "06d00ace-9c31-4f8c-b5f9-179c8d61c6e0",
      "confidence": 85,
      "facts_hash": "88d5ccce729c1cca9a3f8e1e1bf93cceb65fb44ffe6d9225a565564ce6160807",
      "name": "Держатель многофункциональный KRAFTOOL BM1",
      "original_name": "Держатель многофункциональный KRAFTOOL BM1",
      "pav_id": 63012,
      "product_id": 10632,
      "source": "web",
      "source_group": "Измерительный инструмент"
    },
    {
      "applied_at": "2026-07-21T05:02:37.206536+00:00",
      "applied_option_slug": "dinamometricheskie-klyuchi",
      "article": "64053-060",
      "brand": "",
      "change_id": "939c8899-a22b-497e-aad7-10c6c42e14e3",
      "confidence": 100,
      "facts_hash": "5ee7f61c3a4b63f80da81947c3b26d3fde8c2962b248727bc0f095a58b8c5024",
      "name": "Ключ динамометрический  3/8\", 10 - 60 Нм, +/- 4% KRAFTOOL",
      "original_name": "Ключ динамометрический  3/8\", 10 - 60 Нм, +/- 4% KRAFTOOL",
      "pav_id": 63003,
      "product_id": 12957,
      "source": "manual",
      "source_group": "Ключи, головки, воротки, удлинители"
    },
    {
      "applied_at": "2026-07-21T05:05:09.594248+00:00",
      "applied_option_slug": "dinamometricheskie-klyuchi",
      "article": "64053-100",
      "brand": "",
      "change_id": "0bca9e4e-14cb-4e0d-8282-81db575278d7",
      "confidence": 100,
      "facts_hash": "1e57ca8a5669801280238ed9098c4cc1cb9fb8646aee14e7c13b9d8f0d14c1fa",
      "name": "Ключ динамометрический  3/8\", 20 -100 Нм, +/- 4% KRAFTOOL",
      "original_name": "Ключ динамометрический  3/8\", 20 -100 Нм, +/- 4% KRAFTOOL",
      "pav_id": 63004,
      "product_id": 12959,
      "source": "manual",
      "source_group": "Ключи, головки, воротки, удлинители"
    },
    {
      "applied_at": "2026-07-18T20:06:07.996569+00:00",
      "applied_option_slug": "otvertki",
      "article": "64015",
      "brand": "",
      "change_id": "41988c93-167a-430c-8798-432daff1f4a7",
      "confidence": 95,
      "facts_hash": "00025f8f5a40531d7dffbb32205162a74f458ebc60b61789d4b77cb6c5b9b53b",
      "name": "Отвертка динамометрическая ЗУБР регулируемая, 1 - 6 Н/м",
      "original_name": "Отвертка динамометрическая ЗУБР регулируемая, 1 - 6 Н/м",
      "pav_id": 62993,
      "product_id": 13936,
      "source": "web",
      "source_group": "Ключи, головки, воротки, удлинители"
    },
    {